__label__no	Helper class to create and style controls according to an link Action
__label__yes	Class for fetching and merging bibliographic information
__label__no	paranoia ensure that there are never two instances of AllEntriesGroup
__label__yes	Create button that triggers search
__label__no	Activate context menu if user presses the context menu key
__label__yes	nan
__label__no	Add the edit field for Bibtex key
__label__no	Remove all reference marks that don t look like JabRef citations
__label__no	Although entries are redefined without use this also updates linkSourceBase
__label__no	for the remaining entries intersection has to be used this approach ensures that one empty keyword list leads to an empty set of common keywords
__label__no	A very simple implementation of the link TaskExecutor interface Every submitted task is invoked in a separate thread
__label__no	all buttons in base dialogs react on enter
__label__no	but not for this entry
__label__yes	If we found it remove it from the type list
__label__no	The main window of the application
__label__no	Redo the change
__label__no	Tools for automatically detecting OpenOffice or LibreOffice installations
__label__no	Heuristic missed so try to get page number from first shown page
__label__no	Assuming the current page is A4 or has same aspect ratio
__label__yes	Check if there are two entries selected
__label__no	This class controls the user interface of the journal abbreviations dialog The ui elements and their layout are defined in the fxml file
__label__no	only add tab if DB is not already open
__label__no	This class represents the change of type for an entry
__label__no	General
__label__no	Sets the title of the main window
__label__no	check mode of currently used DB
__label__no	No parent root just add
__label__no	write the entries using sw which is used later to form the email content
__label__no	Opens the given files If one of it is null or 404 nothing happens
__label__no	Ask for consent to send data to Mr DLib on first time to tab
__label__no	Only the first of the extensions gotten from FileType is saved into the class using get 0
__label__no	The path to the edited subtree s root node
__label__no	Up to version 2 4b the mime type is not included
__label__no	ApplicationInsights Java Copyright c Microsoft Corporation All rights reserved MIT License Permission is hereby granted free of charge to any person obtaining a copy of this software and associated documentation files the Software to deal in the Software without restriction including without limitation the rights to use copy modify merge publish distribute sublicense and or sell copies of the Software and to permit persons to whom the Software is furnished to do so subject to the following conditions The above copyright notice and this permission notice shall be included in all copies or substantial portions of the Software THE SOFTWARE IS PROVIDED AS IS WITHOUT WARRANTY OF ANY KIND EXPRESS OR IMPLIED INCLUDING BUT NOT LIMITED TO THE WARRANTIES OF MERCHANTABILITY FITNESS FOR A PARTICULAR PURPOSE AND NONINFRINGEMENT IN NO EVENT SHALL THE AUTHORS OR COPYRIGHT HOLDERS BE LIABLE FOR ANY CLAIM DAMAGES OR OTHER LIABILITY WHETHER IN AN ACTION OF CONTRACT TORT OR OTHERWISE ARISING FROM OUT OF OR IN CONNECTION WITH THE SOFTWARE OR THE USE OR OTHER DEALINGS IN THE SOFTWARE
__label__no	On Windows store application as empty if the Default option is selected or if the application name is empty
__label__no	Creates a list of all files leaf nodes in the tree structure which have been selected
__label__yes	css server plus
__label__yes	This method returns the enum constant value
__label__no	Copies the doi url to the clipboard
__label__no	Update type label
__label__no	Update key list to match the new sorting
__label__yes	Runs the given task and returns a Future representing that task
__label__no	Alt on Windows
__label__no	Runs the cleanup on the entry and records the change
__label__no	This action can be invoked without an open database so we have to check if we have one before trying to invoke methods to execute changes in the preferences
__label__no	Set up the list of external file types either from default values or from values recorded in Preferences
__label__no	Notifies the tab that it got focus and should display the given entry
__label__no	handled by FX in TextInputControl paste
__label__yes	File doesn t exist so we can t move it
__label__no	Opens Edit Group Dialog and changes the given group to the edited one
__label__no	We can t watch files directly so monitor their parent directory for updates
__label__no	Extract the list of bibtex keys from a reference mark name
__label__no	leave the expansion state of the tree item as it is
__label__no	Display link to expand text
__label__no	Start looking at changes
__label__no	change root group even though it ll be AllEntries anyway
__label__no	When mime type is included the array length should be 5
__label__yes	Loop through the available databases
__label__no	Replace both entries by merged entry
__label__no	if value null and then call nullField has been omitted as updatefield also handles value null
__label__no	storing a backup of the whole subtree is not required when children are kept
__label__no	Inserts each citation into a HTML body and copies it to the clipboard
__label__no	Only one linked file open directly
__label__yes	If not start GUI
__label__yes	empty
__label__no	After adding the databases go through each and see if any post open actions need to be done For instance checking if we found new entry types that can be imported or checking if the database contents should be modified due to new features in this version of JabRef Note that we have to check whether i does not go over getBasePanelCount This is because importToOpen might have been used which adds to loadedDatabases but not to getBasePanelCount
__label__yes	New ZIP file chooser
__label__yes	expand node and all children on drag over
__label__no	TODO merge with import
__label__yes	css code equal
__label__yes	Find entries in clipboard
__label__no	Access the Child Section s XTextContent interface and insert it into the document
__label__no	Set the visibility of the progress bar in the right end of the status line at the bottom of the frame
__label__no	Converts a path relative to a base path into a class name
__label__no	The following is necesary to initiate the drag and drop in javafx although we don t need the contents It doesn t work without
__label__no	maskText A A
__label__no	Use the correct viewer even if pdf and ps are mixed up
__label__no	This interface defines potential actions that may need to be taken after opening a BIB file into JabRef This can for instance be file upgrade actions that should be offered due to new features in JabRef and may depend on e g which JabRef version the file was last written by This interface is introduced in an attempt to add such functionality in a flexible manner
__label__no	Warning before overwriting is only relevant if overwriting can happen
__label__no	TODO Remove this copy as soon as the one included in AI is compatible with log4j 3
__label__yes	insert the connector
__label__no	As there is no concept like an empty node icon we return simply the other icon
__label__no	Add all bibDatabases databases to the frame
__label__no	This is a simple implementation of a generic suggestion provider callback The complexity of suggestion generation is O n where n is the number of possible suggestions
__label__no	Returns a newer version excluding any non stable versions except if the installed one is unstable too If no newer version was found then an empty optional is returned
__label__no	Prints the connection problem to the status bar and shows a dialog if it was executed manually
__label__yes	css file powerpoint
__label__yes	Detect Google search URL
__label__yes	update keywords
__label__yes	css auto fix
__label__no	Bootstraps the initial component context from a native UNO installation See also code cppuhelper defaultBootstrap InitialComponentContext code
__label__yes	css twitter
__label__no	Drag and drop support
__label__no	File on disk has changed thus look for notable changes and notify listeners in case there are such changes
__label__no	Append a given value to a given field for all entries in a Collection This method DOES NOT update any UndoManager but returns a relevant CompoundEdit that should be registered by the caller
__label__no	We have to use reflection to get the associated label
__label__no	if so mark base changed Prevent the Undo button from removing change marking
__label__no	passed file we take the first one should be focused
__label__no	Decides if the content stored in the given link Dragboard can be droped on the given target row Currently the following sources are allowed another group will be added as subgroup on drop entries if the group implements link GroupEntryChanger will be assigned to group on drop
__label__no	The string was removed or renamed locally We guess that it was removed
__label__no	Returns a consent dialog used to ask permission to send data to Mr DLib
__label__no	Left text pane
__label__no	Initializes the components the layout the data structure and the actions in this dialog
__label__no	Add type change menu
__label__no	This property is only needed to get proper IDE support in FXML files e g validation that parameter passed to icon is indeed of type link IconTheme JabRefIcons
__label__yes	cloud upload
__label__yes	Removal of a node and all of its children
__label__no	This worker checks if there is a new version of JabRef available If there is it will display a dialog to the user offering him multiple options to proceed see changelog go to the download page ignore this version and remind later If the versions check is executed manually and this is the latest version it will also display a dialog to inform the user
__label__yes	If the crossref entry is not already in the database
__label__no	Insert it at the current position
__label__no	especially for the track execute when the action run the same function but from different source
__label__no	Action for the Save and Save as operations called from BasePanel This class is also used for save operations when closing a database or quitting the applications The save operation is loaded off of the GUI thread using link BackgroundTask Callers can query whether the operation was canceled or whether it was successful
__label__no	The default menu that contains functions for changing the case of text and doing several conversions
__label__yes	Set headings
__label__no	This method should be called after storing the preferences to collect the properties which require a restart of JabRef to load
__label__yes	Creates a new auto completion binding between the given textInputControl and the given suggestion provider
__label__no	We accept all kinds of dates not just in the format specified
__label__no	this whole method is part of a background task when autodecting instances so we need to show dialog in FX thread
__label__no	Taken from http stackoverflow com a 9417836 873661
__label__no	We always want that the first item is selected after a change This also automatically selects the first file on the initial load
__label__no	Function to get the command to be executed for pushing keys to be cited
__label__no	For some reason the graphic is not set correctly by the link ActionUtils class so we have to fix this by hand
__label__no	entry type or bibtex key will never be resolved
__label__yes	Removal of a single node Children if any are kept
__label__no	Copyright c 2014 2015 ControlsFX All rights reserved Redistribution and use in source and binary forms with or without modification are permitted provided that the following conditions are met Redistributions of source code must retain the above copyright notice this list of conditions and the following disclaimer Redistributions in binary form must reproduce the above copyright notice this list of conditions and the following disclaimer in the documentation and or other materials provided with the distribution Neither the name of ControlsFX any associated website nor the names of its contributors may be used to endorse or promote products derived from this software without specific prior written permission THIS SOFTWARE IS PROVIDED BY THE COPYRIGHT HOLDERS AND CONTRIBUTORS AS IS AND ANY EXPRESS OR IMPLIED WARRANTIES INCLUDING BUT NOT LIMITED TO THE IMPLIED WARRANTIES OF MERCHANTABILITY AND FITNESS FOR A PARTICULAR PURPOSE ARE DISCLAIMED IN NO EVENT SHALL CONTROLSFX BE LIABLE FOR ANY DIRECT INDIRECT INCIDENTAL SPECIAL EXEMPLARY OR CONSEQUENTIAL DAMAGES INCLUDING BUT NOT LIMITED TO PROCUREMENT OF SUBSTITUTE GOODS OR SERVICES LOSS OF USE DATA OR PROFITS OR BUSINESS INTERRUPTION HOWEVER CAUSED AND ON ANY THEORY OF LIABILITY WHETHER IN CONTRACT STRICT LIABILITY OR TORT INCLUDING NEGLIGENCE OR OTHERWISE ARISING IN ANY WAY OUT OF THE USE OF THIS SOFTWARE EVEN IF ADVISED OF THE POSSIBILITY OF SUCH DAMAGE
__label__no	use property as initial source
__label__yes	Map containing all registered external file types
__label__no	Workaround taken from https bitbucket org controlsfx controlsfx issues 330 making textfieldssetupclearbuttonfield
__label__no	Always overwrite keys by default
__label__no	We are not alone there is already a server out there send command line arguments to other instance
__label__yes	Process arguments
__label__no	Nothing set so we use the default values
__label__no	Run the actual open in a thread to prevent the program locking until the file is loaded
__label__no	It could be that somehow the path is null for example if it got deleted in the meantime
__label__no	extract url parameter
__label__no	Collect all callables to execute in one collection
__label__no	TODO Add undo Store undo information AbstractUndoableEdit undoAddPreviousEntries null UndoableModifyGroup undo new UndoableModifyGroup GroupSelector this groupsRoot node newGroup if undoAddPreviousEntries null panel getUndoManager addEdit undo else NamedCompound nc new NamedCompound Modify Group nc addEdit undo nc addEdit undoAddPreviousEntries nc end panel getUndoManager addEdit nc if addChange isEmpty undoAddPreviousEntries UndoableChangeEntriesOfGroup getUndoableEdit null addChange
__label__no	Adds the filename to the top of the menu If it already is in the menu it is merely moved to the top
__label__no	This view model can be used both for add exporter and modify exporter functionalities It takes an optional exporter which is empty for add exporter and takes the selected exporter for modify exporter It returns an optional exporter which empty if an invalid or no exporter is created and otherwise contains the exporter to be added or that is modified
__label__no	We need to catch this one here because the OpenOfficePanel class is loaded before connection and therefore cannot directly reference or catch a DisposedException which is in a OO JAR file
__label__yes	css label outline
__label__no	This resize policy is almost the same as link TableView CONSTRAINED RESIZE POLICY We make sure that the width of all columns sums up to the total width of the table However in contrast to link TableView CONSTRAINED RESIZE POLICY we size the columns initially by their preferred width
__label__no	We have to cast the BibEntries from the BibEntrySuggestionProvider to ParsedEntryLink
__label__no	Puts A List of link BibEntry in the map All previous content is cleared
__label__no	This wraps the old Swing commands so that they fit into the new infrastructure In the long term this class should be removed
__label__no	run in one minute
__label__no	See if there are duplicate citations marks referring to different entries If so we need to use uniquefiers
__label__no	TODO http api openoffice org docs DevelopersGuide OfficeDev OfficeDev xhtml 1 1 3 2 1 2 Frame Hierarchies
__label__no	TODO Print error message Localization lang Error while writing file toString ex
__label__no	Parse the modified file
__label__no	Represents a binding between a text input control and a auto completion popup This class is a slightly modified version of link impl org controlsfx autocompletion AutoCompletionTextFieldBinding that works with general text input controls instead of just text fields
__label__no	Creates an instance of link LinkedFile based on the given file We try to guess the file type and relativize the path against the given file directories TODO Move this method to link LinkedFile as soon as link CustomExternalFileType lives in model
__label__no	Create a default suggestion provider based on the toString method of the generic objects using the provided stringConverter
__label__yes	Remove entry
__label__no	Repaints the table with the most recent font configuration
__label__no	Updates the timestamp of changed entries if the feature is enabled
__label__yes	Add the new component
__label__no	Setting the character format failed so we throw an exception that will result in an error message for the user
__label__no	Implementation of link TaskExecutor that runs every task on the current thread i e in a sequential order This class is not designed to be used in production but should make code involving asynchronous operations deterministic and testable
__label__no	No file matched the name try to open it directly using the given app
__label__no	Represents the viewport for a page Note the instances of link DocumentViewerPage are reused i e not every page is rendered in a new instance but instead link DocumentViewerPage updateItem Object is called
__label__no	Set a given field to a given value for all entries in a Collection This method DOES NOT update any UndoManager but returns a relevant CompoundEdit that should be registered by the caller
__label__no	Go back to the relevant position
__label__no	Displays an BibEntry using the given layout format
__label__no	Saved now exit
__label__no	Try to get as much information from the temporal accessor
__label__no	There is apparently no neat way to get the page number from a PDPage thus this old style for loop
__label__no	Read the prefs information for file types
__label__no	start office process
__label__no	Make a list of all PDFs linked from this entry
__label__no	This method is called when the dialog is opened or if it is made visible after being hidden This calls the appropriate method in the ViewModel
__label__yes	Perform migrations
__label__no	Constructs a link TableCell based on the value of the cell and a bunch of specified converter methods
__label__no	store new patterns globally
__label__no	A backup of the groups before the modification
__label__no	MappedList implementation based on https github com corda corda blob master client jfx src main kotlin net corda client jfx utils MappedList kt
__label__no	Start of ugly hack We need to find out which tabs will be shown and which not and remove and re add the appropriate tabs to the editor We don t want to simply remove all and re add the complete list of visible tabs because the tabs give an ugly animation the looks like all tabs are shifting in from the right This hack is required since tabbed getTabs setAll visibleTabs changes the order of the tabs in the editor
__label__no	make sure the layout is set according to the checkbox
__label__no	shift on win or no modifier
__label__yes	expand or collapse the tree item and reset the time
__label__no	The user wants to save
__label__no	Open the file
__label__yes	Returns the path to the system s applications folder
__label__yes	Opens a shared database
__label__yes	no parameters
__label__no	This will wrap the built in and ieee abbreviations in pseudo abbreviation files and add them to the list of journal abbreviation files
__label__yes	url
__label__yes	First remove tabs that we do not want to show
__label__no	Prevent right click to select group
__label__yes	css close circle
__label__no	Unknown external file type This instance represents a file type unknown to JabRef This can happen for example when a database is loaded which contains links to files of a type that has not been defined on this JabRef instance
__label__no	Wait 500 ms then try to connect again but do not wait longer than 5 min 600 500 ms total
__label__no	Returns a text formatter that restricts input to integers
__label__yes	Format a name field for the table according to user preferences
__label__yes	css view list
__label__no	Ok we have seen this exact marker before
__label__no	Execute the callables and wait for the results
__label__no	Stores all user dialogs related to link BackupManager
__label__yes	Nothing to do here
__label__no	The minimum number of selected entries to ask the user for confirmation
__label__no	Exception used to indicate that the plugin attempted to set a character format that is not defined in the current OpenOffice document
__label__no	create call with arguments We need a socket pipe does not work https api libreoffice org examples examples html
__label__yes	imageView setImage new WritableImage getDesiredWidth getDesiredHeight
__label__no	Return a boolean if the selected entry have url or doi
__label__no	This class can be used to wrap a see StringProperty inside it When wrapped any Listener listening for updates to the wrapped StringProperty for example because of a binding to it is ensured to be notified on the JavaFX Application Thread It should be used to implement bindings where updates come in from a background thread but should be reflected in the UI where it is necessary that changes to the UI are performed on the JavaFX Application thread
__label__yes	prefs putBoolean JabRefPreferences WINDOW MAXIMISED getExtendedState Frame MAXIMIZED BOTH
__label__yes	Dialog for managing term list files
__label__no	Check if a path to the command has been specified
__label__no	Will only happen if field exists
__label__no	We need to make a copy as instances of LogEvent are reused by log4j
__label__yes	perform permutation
__label__yes	Stream allMatch in contrast to Stream anyMatch returns true for empty streams so this has to be checked explicitly
__label__no	If there is no value do nothing
__label__no	Set the default value
__label__no	Update the citation list depending on the selected reference
__label__no	Enable actions that depend on Connect
__label__yes	Deleted since it does not work anymore Needs refactoring MenuItem previousPreviewLayout new MenuItem Localization lang Previous preview layout previousPreviewLayout setAccelerator keyBindingRepository getKeyCombination KeyBinding PREVIOUS PREVIEW LAYOUT previousPreviewLayout setOnAction event basePanel previousPreviewStyle MenuItem nextPreviewLayout new MenuItem Localization lang Next preview layout nextPreviewLayout setAccelerator keyBindingRepository getKeyCombination KeyBinding NEXT PREVIEW LAYOUT nextPreviewLayout setOnAction event basePanel nextPreviewStyle
__label__no	for all types
__label__no	We only handle ENTRY MODIFY here so the context is always a Path
__label__yes	Opens the given URL using the system browser
__label__yes	Constructor taking two entries
__label__no	We create a decoration pane ourselves for performance reasons otherwise it has to be injected later leading to a complete redraw relayout of the complete scene
__label__yes	css eye
__label__yes	first check if a valid entry is selected
__label__no	Return a string for displaying a node name and its number of children if it is a directory
__label__yes	Dir must be a folder not a file
__label__yes	Set up key bindings specific for the entry editor
__label__no	Bootstraps a servicemanager with the jurt base components registered See also UNOIDL code com sun star lang ServiceManager code
__label__no	The footnote s anchor gives the correct position in the text
__label__no	See if it helps to append in
__label__no	Remove annotations for the current entry and reinitialize annotation cache
__label__no	For some reason the graphic is not set correctly so let s fix this
__label__no	Set up groups tree
__label__no	Store the directory for next time
__label__no	those threads will be allowed to finish
__label__no	Fetches possibly saved data and configures the control elements respectively
__label__no	Exception used to indicate that the plugin attempted to set a character format that is not defined in the current OpenOffice document
__label__no	Autosave
__label__yes	Sets the indeterminate status of the progress bar p
__label__no	The action was either canceled or unsuccessful
__label__no	Remove fields which are not in the merged entry unless they are internal fields
__label__no	Text before the citation
__label__yes	entry type
__label__yes	Display warnings if any
__label__yes	Set the string associated with this file type s icon
__label__yes	Added comparator for Read Status
__label__no	This constructor should only be called to create a pseudo abbreviation file for built in lists This means it is a placeholder and it s path will be null meaning it has no place on the filesystem It s isPseudoFile property will therefore be set to true
__label__no	TODO reflective access should be removed
__label__no	A new or modified entry type Construct it from the string array
__label__no	To account for numbering and for uniqiefiers we must refresh the cite markers
__label__no	Open a http pdf ps viewer for the given link string
__label__yes	General
__label__no	Read all keybindings from the keybinding repository and create table keybinding models for them
__label__no	Text leading up to s1 Insert s2
__label__no	Migrations Warning for migrating the Review into the Comment field
__label__no	TODO Show detailed description of the changes StringBuilder sb new StringBuilder html Localization lang Changes have been made to the following metadata elements p br nbsp nbsp sb append changes stream map unit unit key collect Collectors joining br nbsp nbsp sb append html infoPane setText sb toString
__label__no	Global String constants for GUI actions
__label__no	Put everything together
__label__yes	Check if we should italicize the et al string in citations
